{
  "id": 2,
  "champion": "HERO_08",
  "boss": "TU4b_001",
  "boss_power": "VAN_HERO_08bp",
  "powers_locked": true,
  "unlosable": true,
  "boss_guarded": false,
  "end_turn_block": {"while_can_play": true, "while_can_attack": true},
  "player": {
    "mana": 1,
    "hand": ["VAN_CS2_172", "VAN_CS2_168"],
    "deck": [
      "VAN_CS2_120", "VAN_CS2_122", "VAN_CS2_118", "VAN_CS2_182", "VAN_CS2_124", "VAN_CS2_122", "VAN_CS2_200",
      "VAN_CS2_119", "VAN_CS2_201", "VAN_CS2_222", "VAN_CS2_120", "VAN_CS2_182", "VAN_CS2_200"
    ]
  },
  "boss_deck": [
    "VAN_EX1_277", "VAN_CS2_024", "VAN_CS2_025", "VAN_CS2_024", "VAN_CS2_029", "VAN_EX1_277", "VAN_CS2_026",
    "VAN_CS2_025", "VAN_CS2_029", "VAN_CS2_032", "VAN_EX1_279", "VAN_EX1_279"
  ],
  "mulligan": false,
  "reward": "VAN_EX1_015",
  "hints": ["mana", "play", "attack", "raid_leader"],
  "script": null
}
