{
  "id": 1,
  "champion": "HERO_08",
  "boss": "TU4a_001",
  "boss_power": "VAN_HERO_08bp",
  "powers_locked": true,
  "boss_guarded": false,
  "end_turn_block": {"while_can_play": true, "while_can_attack": true},
  "player": {
    "mana": 1,
    "hand": ["VAN_CS2_168"],
    "deck": [
      "VAN_CS2_172", "VAN_CS2_120", "VAN_CS2_118", "VAN_CS2_182", "VAN_CS2_124", "VAN_CS2_200", "VAN_CS2_172",
      "VAN_CS2_168", "VAN_CS2_120", "VAN_CS2_182", "VAN_CS2_124", "VAN_CS2_200", "VAN_CS2_201"
    ]
  },
  "boss_deck": [
    "TU4a_002", "TU4a_003", "TU4a_002", "TU4a_004", "TU4a_005", "TU4a_003", "TU4a_002", "TU4a_005", "TU4a_004",
    "TU4a_003", "TU4a_002", "TU4a_005"
  ],
  "mulligan": false,
  "reward": "VAN_CS2_023",
  "hints": ["play", "attack", "end_turn"],
  "script": "scripts/tutorial.lua#ench:tutorial_guard"
}
